{"$schema":"https://json-schema.org/draft/2020-12/schema","$id":"https://mindclade.dev/schemas/feature-coverage-manifest/v1","title":"FeatureCoverageManifest","type":"object","additionalProperties":false,"required":["schema_version","kind","metadata","spec","lineage","integrity"],"properties":{"schema_version":{"const":"mindclade.feature-coverage-manifest/v1"},"kind":{"const":"FeatureCoverageManifest"},"metadata":{"$ref":"#/$defs/metadata"},"spec":{"type":"object","additionalProperties":false,"required":["requirement_set","feature_bundle","satisfied_requirements","missing_requirements","coverage_ratio"],"properties":{"requirement_set":{"$ref":"#/$defs/artifact_ref"},"feature_bundle":{"$ref":"#/$defs/artifact_ref"},"satisfied_requirements":{"type":"array","minItems":1,"maxItems":256,"uniqueItems":true,"items":{"type":"string","minLength":1,"maxLength":128}},"missing_requirements":{"type":"array","maxItems":0,"items":{"type":"string"}},"coverage_ratio":{"const":1.0}}},"lineage":{"type":"array","minItems":2,"maxItems":64,"items":{"$ref":"#/$defs/artifact_ref"}},"integrity":{"$ref":"#/$defs/integrity"}},"$defs":{"digest":{"type":"string","pattern":"^sha256:[a-f0-9]{64}$"},"metadata":{"type":"object","additionalProperties":false,"required":["uid","created_at","producer","classification"],"properties":{"uid":{"type":"string","minLength":1,"maxLength":128},"created_at":{"type":"string","format":"date-time"},"producer":{"type":"string","minLength":1,"maxLength":128},"classification":{"enum":["PUBLIC","INTERNAL","RESTRICTED"]}}},"artifact_ref":{"type":"object","additionalProperties":false,"required":["uri","digest","media_type","schema_version"],"properties":{"uri":{"type":"string","pattern":"^artifacts/[A-Za-z0-9._~/-]+$"},"digest":{"$ref":"#/$defs/digest"},"media_type":{"type":"string","minLength":1,"maxLength":128},"schema_version":{"type":"string","minLength":1,"maxLength":128}}},"integrity":{"type":"object","additionalProperties":false,"required":["payload_digest"],"properties":{"payload_digest":{"$ref":"#/$defs/digest"},"evidence":{"type":"array","maxItems":32,"items":{"$ref":"#/$defs/artifact_ref"}}}}}}
