{"schema_version":"mindclade.feature-coverage-manifest/v1","kind":"FeatureCoverageManifest","metadata":{"uid":"coverage-001","created_at":"2026-08-31T12:00:00Z","producer":"feature-validator","classification":"INTERNAL"},"spec":{"requirement_set":{"uri":"artifacts/requirements/001","digest":"sha256:aaaaaaaaaaaaaaaaaaaaaaaaaaaaaaaaaaaaaaaaaaaaaaaaaaaaaaaaaaaaaaaa","media_type":"application/schema+json","schema_version":"mindclade.feature-requirement-set/v1"},"feature_bundle":{"uri":"artifacts/feature-bundles/001","digest":"sha256:bbbbbbbbbbbbbbbbbbbbbbbbbbbbbbbbbbbbbbbbbbbbbbbbbbbbbbbbbbbbbbbb","media_type":"application/schema+json","schema_version":"mindclade.feature-bundle/v1"},"satisfied_requirements":["feature/residue.confidence@v1"],"missing_requirements":[],"coverage_ratio":1.0},"lineage":[{"uri":"artifacts/requirements/001","digest":"sha256:aaaaaaaaaaaaaaaaaaaaaaaaaaaaaaaaaaaaaaaaaaaaaaaaaaaaaaaaaaaaaaaa","media_type":"application/schema+json","schema_version":"mindclade.feature-requirement-set/v1"},{"uri":"artifacts/feature-bundles/001","digest":"sha256:bbbbbbbbbbbbbbbbbbbbbbbbbbbbbbbbbbbbbbbbbbbbbbbbbbbbbbbbbbbbbbbb","media_type":"application/schema+json","schema_version":"mindclade.feature-bundle/v1"}],"integrity":{"payload_digest":"sha256:cccccccccccccccccccccccccccccccccccccccccccccccccccccccccccccccc","evidence":[]}}
